{
  "schema": "srp.answer.v1",
  "answer_id": "answer_018f0f4a-5c00-4000-8000-000000000001",
  "project_id": "project_018f0f4a-5c00-4000-8000-000000000001",
  "revision": 1,
  "supersedes_revision": null,
  "state": "draft",
  "title": "A reproducible synthesis",
  "synthesis": "The observed effect follows under the declared assumptions.",
  "limitations": ["The external cohort remains untested."],
  "question_ref": { "kind": "question", "id": "question_018f0f4a-5c00-4000-8000-000000000001", "revision": 1 },
  "additional_inputs": [],
  "created_at": "2026-08-30T06:00:00.000Z",
  "created_by": "actor_01"
}
